https://lh3.googleusercontent.com/a-/ALV-UjWllkWV_3bwr1V7IEjzc3UX8AyASNJXtOfSlXF0sIVtgSvJ=w72-h72-p-rp-mo-ba6-br100,Richard W.,"Local Guide · 601 reviews · 2,241 photos",a year ago,I'll come back every once in a while to see if there are any new ones.
https://lh3.googleusercontent.com/a-/ALV-UjU-hIQbKvxZuWdBQ9n4MKRH3YwyJqVVz4q3BRdFXXFdqloB=w72-h72-p-rp-mo-ba6-br100,Björn,"Local Guide · 286 reviews · 2,001 photos",7 years ago,"Super nice employee
Large selection of clothing
A few offers here and there too"
https://lh3.googleusercontent.com/a-/ALV-UjVL4GHAnIrbd7pMrQ5QlD_ydCvc12DfU0x7m24Ey0ypb9I=w72-h72-p-rp-mo-ba4-br100,Elias Veske,Local Guide · 88 reviews · 1 photo,4 years ago,"Marc is the best seller no matter what he would tell me I would have bought it without thinking, a great guy and a cool shop just because of Marc the best Adidas shop in all of ffm"
https://lh3.googleusercontent.com/a/ACg8ocLfUydTCZqqUSXaHxVMzeSI-GXuWcKQbLLFsEVMNFNm=w72-h72-p-rp-mo-ba4-br100,Martina Gella,Local Guide · 161 reviews · 125 photos,4 years ago,Great shop right on the Zeil. Clearly designed. Large selection
https://lh3.googleusercontent.com/a/ACg8ocJmWxRsvVRWh1ieBT4-4c4SGuODRfgyZIvlIQbfW3ZP=w72-h72-p-rp-mo-br100,Astrid,16 reviews,a year ago,"Top advice. Unfortunately, completely unaccommodating in the event of a complaint."
https://lh3.googleusercontent.com/a/ACg8ocJoMp1tIRye_0BX2QHqxuhQAWpQ8WTMxxU_sdx4SBGq=w72-h72-p-rp-mo-ba3-br100,森井雅史,Local Guide · 38 reviews · 58 photos,2 years ago,The Star Wars stadium jacket I bought on a trip to Europe with Nishi-kun in September 2010 is still a treasure.
https://lh3.googleusercontent.com/a-/ALV-UjX-rySeLHoO9HVarKZUQpK3ZIjjhzMMQXdnfWnPi2tTpsQ=w72-h72-p-rp-mo-ba4-br100,Tatjana Stutz,Local Guide · 143 reviews · 74 photos,4 years ago,"Very nice, unfortunately the selection is not that big"
https://lh3.googleusercontent.com/a-/ALV-UjW-H8SDcvCvQLZKZs1Mg2RBYGrG_V0CL96_x_0ECrxC_g=w72-h72-p-rp-mo-ba5-br100,Benjamin Leising,Local Guide · 381 reviews · 102 photos,a year ago,Big and a bit confusing. Otherwise interesting.
https://lh3.googleusercontent.com/a-/ALV-UjUAXsE7F04s_7Np0wqK1nNB53u3gJZrlCmCgDdFuHOUzBI=w72-h72-p-rp-mo-ba3-br100,n1ckxwlx,Local Guide · 50 reviews · 8 photos,2 years ago,Large selection of goods and 2G was also checked.
https://lh3.googleusercontent.com/a-/ALV-UjXTvUwEZIx8B1kA7nuK--RSaBu8yBWt3_I9L_nAKTusrJ0m=w72-h72-p-rp-mo-ba5-br100,Marilyn Mache,"Local Guide · 153 reviews · 1,599 photos",5 years ago,"Very good selection including sales.
Staff very helpful."
https://lh3.googleusercontent.com/a-/ALV-UjUE81zLxVaVW6IKeX0-dNVmQiQcu2TlP45FecCneKcP1ME=w72-h72-p-rp-mo-ba5-br100,Christoph Skrzypek,Local Guide · 349 reviews · 21 photos,4 years ago,"Well submitted but the shoe sizes are
Not suitable for Europeans. Shoes that are too narrow are more suitable for Asians"
https://lh3.googleusercontent.com/a-/ALV-UjVj7xevIGoxAfS9NUIRUaN5seuc0houMOSoxdmrSVwjtT7F=w72-h72-p-rp-mo-ba4-br100,Vilma Mackeviciene,Local Guide · 57 reviews · 30 photos,3 years ago,I bought gloves and socks for my son-in-law. The Christmas present will go to Lithuania. I am satisfied❤
https://lh3.googleusercontent.com/a-/ALV-UjVBHrJfQlY9iOLixFdtY6lMTab7nRGdvGM-HD4lIwjbU3Q=w72-h72-p-rp-mo-ba5-br100,Diego C.,Local Guide · 301 reviews · 49 photos,2 years ago,It hardly has any gender. There are more Adidas products in the surrounding stores. 100% avoidable.
https://lh3.googleusercontent.com/a-/ALV-UjWsl-LAXH9Eo7zxpm8DoYxCXRDWoBb-Hv66u0IFopuMBiU=w72-h72-p-rp-mo-br100,Nazelnut,15 reviews,4 years ago,"Tidy store, nice employees and clean, large changing rooms. Was there once and satisfied!"
https://lh3.googleusercontent.com/a/ACg8ocInJtZ2AbrCTrYtzHsyep8agTt9_9L3i439EuZRUMMR=w72-h72-p-rp-mo-br100,Francisco Javier Ramirez Moreno,9 reviews,a year ago,"Great advice
Great ambience
Great seller"
https://lh3.googleusercontent.com/a-/ALV-UjVuNPf8Ces4BF4bEoX5GGb715A_l8oedlzviQjZc7A-mDg=w72-h72-p-rp-mo-br100,G4k1ss,22 reviews,10 months ago,"it's ok, but expensive"
https://lh3.googleusercontent.com/a-/ALV-UjWq0BIpssOHjRbBb34kfdniGGVkwsYwYTLM0Kp2EY1-ZOM=w72-h72-p-rp-mo-ba5-br100,Nordschleife Nürburgring,"Local Guide · 424 reviews · 1,789 photos",6 years ago,"I went there expecting to find an authentic adidas shop, but the store was small and there weren't many products. I ended up not buying anything."
https://lh3.googleusercontent.com/a-/ALV-UjUB2jEIg2ujMIg5M4ZUD6niRRYaRV288f8In8hyGyBfrA=w72-h72-p-rp-mo-ba3-br100,Roibn Sheel,Local Guide · 39 reviews · 3 photos,5 years ago,What a bad store....Rude staff etc. Never again
https://lh3.googleusercontent.com/a-/ALV-UjUO2MDNfhfUHrZDR15CNv9nk42WcXmfPkdcVaMJSiZw3wI=w72-h72-p-rp-mo-ba4-br100,Carsten Pötter,Local Guide · 26 reviews · 15 photos,6 years ago,"Unfortunately there is little selection in the store, which is really disappointing.
The big plus, however, is Click & Collect via the Adidas website."
https://lh3.googleusercontent.com/a-/ALV-UjW9CXP2ZSwvQIuQoGjKRUwRd_2oiR6YmNxiZtljRs3q4s1D=w72-h72-p-rp-mo-ba3-br100,Siyar G,Local Guide · 38 reviews · 4 photos,4 years ago,"Very nice staff and large selection, Adidas is and remains my personal favorite!"
https://lh3.googleusercontent.com/a-/ALV-UjVROF88yDCzjll_IxA2zjsCOOnoS9Cv7eDSPBbfFzmK4w=w72-h72-p-rp-mo-ba3-br100,신유미,Local Guide · 45 reviews · 66 photos,5 years ago,The staff is not friendly and it doesn't work with Jcb cards. Passport was required at checkout.
https://lh3.googleusercontent.com/a/ACg8ocL--2HSnq1I3S-20o85u51gWhQQm3WhB39S1ERTEFIHUg=w72-h72-p-rp-mo-ba3-br100,Max,Local Guide · 49 reviews · 1 photo,4 years ago,Great store with all Adidas clothes - the price is right. Good employees
https://lh3.googleusercontent.com/a/ACg8ocLKDV_dwc6ukIvITGA4_KN_h7vZalrFnCnNWOP7rH6l=w72-h72-p-rp-mo-br100,Ronny .Fiedler,1 review,a year ago,One star because the sweater is so nice
https://lh3.googleusercontent.com/a-/ALV-UjW-Wm2CCeHQJ3xyu7vlMTAUSeWKvhkSWehr5wsQH9UlTgc=w72-h72-p-rp-mo-br100,Isaac,11 reviews,2 years ago,"Nice shop, helpful staff."
https://lh3.googleusercontent.com/a/ACg8ocID1GTIvavoSHr9Lz1IFJY26cZT1v28tQO2tWbqVaJb=w72-h72-p-rp-mo-br100,Marco Antonio Barriga Gomez,3 reviews · 16 photos,a year ago,"Thank you very much, very good treatment from the clerks, thank you"
https://lh3.googleusercontent.com/a-/ALV-UjV7KcSnJcNd95zfDvxNgASRqC3fwNHkAUpA-vr1scDgDP5e=w72-h72-p-rp-mo-ba4-br100,Samuel GOLDERY,Local Guide · 153 reviews · 226 photos,5 years ago,Obligatory passage ! Lots of choice... nice store
https://lh3.googleusercontent.com/a-/ALV-UjVF1AeDJM6QSYwfJA0ySyCydS2LP65voPVA3aDqbZe5eAk=w72-h72-p-rp-mo-ba5-br100,Michael Naegele,Local Guide · 381 reviews · 313 photos,3 years ago,Great store. Nice personel. Cool things.
https://lh3.googleusercontent.com/a/ACg8ocKXi0SLpdnG0N_FzFSZzXH_iiFUCvfhZxR3wlaBi_Zm=w72-h72-p-rp-mo-ba3-br100,Tobias Gurbisz,Local Guide · 39 reviews · 2 photos,7 years ago,"I now had 3 pairs of shoes each worth over €80 each pair, the shoes broke after a short time, I actually only ever bought Adidas but now I've switched to Nike"
https://lh3.googleusercontent.com/a/ACg8ocJ9_RRxYi4I9evNOKgZG4nOA37ZqYNcjqKHGHnCqcye=w72-h72-p-rp-mo-ba2-br100,Jenny Reimer,Local Guide · 20 reviews · 1 photo,6 years ago,Very nice staff! large selection of clothes for both women and men
https://lh3.googleusercontent.com/a-/ALV-UjU5in1XIlEf4xt_TC4lYLWPBnZUKrPA3J4UwkbJvLLT4ndD=w72-h72-p-rp-mo-ba4-br100,Luis Bramato,Local Guide · 27 reviews · 210 photos,5 years ago,Clear and clean shop. Nice personel. All the latest Adidas products found.
https://lh3.googleusercontent.com/a-/ALV-UjWRXl1WQX005JVoBNmYn_71PP2YvBM_EB1kILuAEBPbtf8=w72-h72-p-rp-mo-ba4-br100,right_guyyy,Local Guide · 27 reviews · 39 photos,4 years ago,"Nice staff, modern, clean, open and really pleasant."
https://lh3.googleusercontent.com/a/ACg8ocIfPSoOKhW05jfo7NY3CruvdJ7qHwGMn_C6BHnY9AWA=w72-h72-p-rp-mo-br100,SERGEN ZWERGEN,12 reviews,6 years ago,"I'm only doing this so that SHE thinks I'm good.
But trz is nike hotter, sorry “babe”.
Are Liv getting married?"
https://lh3.googleusercontent.com/a-/ALV-UjXolFNWeX68IC5Nn8mZQ9NVAprdkIht5WiJZYcZK2WsDibM=w72-h72-p-rp-mo-ba7-br100,Joe F.,"Local Guide · 1,126 reviews · 2,519 photos",5 years ago,Very friendly service and exemplary advice.
https://lh3.googleusercontent.com/a-/ALV-UjV6jyWKhx54XPdT2Ka68rfHiZovDc_VZyWYgM-DW3O6mQcA=w72-h72-p-rp-mo-ba5-br100,Dani Capotosti,Local Guide · 259 reviews · 2 photos,a year ago,Very kind to serve
https://lh3.googleusercontent.com/a/ACg8ocJ48P5OfTk_6sT0s7w8Zre7sYxCxz6f5pBgbz9uCsuc=w72-h72-p-rp-mo-ba4-br100,Carsten Becker,Local Guide · 247 reviews · 2 photos,2 years ago,"Very friendly, great selection."
https://lh3.googleusercontent.com/a-/ALV-UjVmOWENKUFaicprpnnv-25PTXVlVK2ZWie9lD_mjVeUIxU=w72-h72-p-rp-mo-ba4-br100,Hassib Qureshi,Local Guide · 60 reviews,5 years ago,There is nothing special for an Adidas store. Little to hardly any selection.
https://lh3.googleusercontent.com/a-/ALV-UjUwuZaKaxSfNxGLug2IdWIFaIlzqIINFiyAgqVkFbvy4Fg=w72-h72-p-rp-mo-ba4-br100,Jadranka Baranek,Local Guide · 121 reviews · 3 photos,5 years ago,Pleasant and quality shopping with the help of professional staff
https://lh3.googleusercontent.com/a/ACg8ocIfIFxsaDKNqtHckum2-v7QCEuNGouCPzj5rXdnWLEi=w72-h72-p-rp-mo-br100,Jürgen Meitner,5 reviews,3 years ago,Always had a good experience so far
https://lh3.googleusercontent.com/a-/ALV-UjUW8EYksnnHYps21aHUot7CxevQpdwVJj2y8ofgE7DFRAg=w72-h72-p-rp-mo-br100,ANTI SI-TOWN MOOS,18 reviews · 22 photos,2 years ago,"Too boring
Cheap shoes intended for Hartz 5 infinger
Or homeless people"
https://lh3.googleusercontent.com/a/ACg8ocJZvWmtExEIj-7g4vCtvJDUbQozaP1X3R6ce992mMQ=w72-h72-p-rp-mo-ba2-br100,Lidia Meiser,Local Guide · 8 reviews,6 years ago,The staff is very friendly and competent.
https://lh3.googleusercontent.com/a-/ALV-UjVjoqd5JCS7pFYbB_MxOiBgfLh7iHSQYDf-zLXlLDUeTtY=w72-h72-p-rp-mo-ba4-br100,roodmood1,Local Guide · 159 reviews · 38 photos,5 years ago,I would have liked a little more choice.
https://lh3.googleusercontent.com/a/ACg8ocJh-74ntapmidum27ln9DVEnM4d-u1lJ1cy0hdNC9au=w72-h72-p-rp-mo-ba4-br100,Markus Schmidt,Local Guide · 133 reviews · 60 photos,4 years ago,"Very friendly, very great offer"
https://lh3.googleusercontent.com/a-/ALV-UjWnvCifbIItc7TL2cw7O_eSR1hykWWni20ZhEg3_-NsKjWA=w72-h72-p-rp-mo-ba3-br100,15 ioba08,Local Guide · 64 reviews · 49 photos,a year ago,"There aren't many products, and the checkout is slow."
https://lh3.googleusercontent.com/a/ACg8ocJfD2Am3EhdI4NftWQ0SDEGews4E5f8Pa23j2mDtXFH=w72-h72-p-rp-mo-br100,Tim Schnitter,3 reviews,7 years ago,"Great quality as always, I always buy something for my son"
https://lh3.googleusercontent.com/a-/ALV-UjUnkFaH6GBpIWEwSzqXWUZv_ZaEeBPNPkVRHcVpiJssjZ8=w72-h72-p-rp-mo-ba3-br100,Salih Gencer,Local Guide · 12 reviews · 5 photos,4 years ago,Service and friendliness are perfectly coordinated here
https://lh3.googleusercontent.com/a/ACg8ocLXWRKXORbaj5ouAIVu8dvdMmcnybDd1DXpJHe970ho=w72-h72-p-rp-mo-br100,Ivan Mendes,96 reviews · 80 photos,5 years ago,Unfortunately no çabuk sikici pantolon in my size
https://lh3.googleusercontent.com/a-/ALV-UjWcTBtwbspVTmruwoVjTWHzc__93KsSBYNOOj7Jl2oCXfA=w72-h72-p-rp-mo-ba5-br100,Björn Mika,Local Guide · 218 reviews · 425 photos,2 years ago,"Nice, friendly and helpful staff."
https://lh3.googleusercontent.com/a-/ALV-UjWrdsYeAsbDJQARViBRE_OSGHVOF3stdqqKeBtJcyUvKFK4=w72-h72-p-rp-mo-ba4-br100,Žaneta Cerin Jokić,Local Guide · 84 reviews · 241 photos,4 years ago,The choice of numbers is always excellent. Gazelles for ten...
https://lh3.googleusercontent.com/a-/ALV-UjXYeULpOJmSDogfl2sX5WCD5YhprqaT71VtkM4gCUg-J-8=w72-h72-p-rp-mo-ba3-br100,Mehmet Nyr,Local Guide · 37 reviews · 13 photos,11 months ago,Great load 👋 …
https://lh3.googleusercontent.com/a/ACg8ocK8TpZmfT7WHS7GflIkBKAbs6KScB72CywPg8OIdlV8=w72-h72-p-rp-mo-br100,Chris Gjoni,6 reviews,5 years ago,Very good staff and fast at the same time
https://lh3.googleusercontent.com/a-/ALV-UjUp2DwCInhHHaV7bfVV_545hBLGWrgdjeJazxPQ1xA-djQ=w72-h72-p-rp-mo-ba3-br100,Musdaq Banafa,Local Guide · 39 reviews · 9 photos,4 years ago,Very nice shop with helpful employees
https://lh3.googleusercontent.com/a-/ALV-UjWLky-h-wWBjRxbyQVlZPq3f-N7v0R4hrgKUqf9r-tLawI=w72-h72-p-rp-mo-ba4-br100,pm DocDeath,Local Guide · 59 reviews · 4 photos,3 years ago,Very nice advice and service.
https://lh3.googleusercontent.com/a/ACg8ocIsZKikKABT0slSpQN_mrHet8uyNbbf9738ELP82387=w72-h72-p-rp-mo-ba3-br100,Oli Punkt,Local Guide · 24 reviews · 19 photos,3 years ago,Purchased item not as described. No support
https://lh3.googleusercontent.com/a-/ALV-UjVNX6ZY7Qa58Qga310VImElwzS3XNQNuOof8_pasMkvox8=w72-h72-p-rp-mo-ba4-br100,Daniel,Local Guide · 76 reviews · 35 photos,3 years ago,The staff is super friendly and helpful.
https://lh3.googleusercontent.com/a-/ALV-UjXyLVN1yQgZWztVXT61q34hqjnXKy3hg_4Rogok1N0uGBM3=w72-h72-p-rp-mo-ba6-br100,Carlos José,"Local Guide · 458 reviews · 1,675 photos",4 years ago,It's not long before low prices
https://lh3.googleusercontent.com/a-/ALV-UjU_h84-y2WB9gzOMOHEzVcpsCHDDHXPqoEMm-hfHGH4gnE=w72-h72-p-rp-mo-ba5-br100,René Pahl,"Local Guide · 225 reviews · 1,143 photos",5 years ago,There is no teamwear catalog. Service is missing...
https://lh3.googleusercontent.com/a/ACg8ocKwgXpGFDK91zwgCuYwP3oTHx3xDUg0lSURyRKU2Ydw=w72-h72-p-rp-mo-ba4-br100,Andreas Müller,Local Guide · 130 reviews · 361 photos,4 years ago,"Loose advice, not cheap but good selection"
https://lh3.googleusercontent.com/a-/ALV-UjWXKb5-uvJXopaxhfbD6ACCVZoI7I8mxW17JkqIJdmdCuo=w72-h72-p-rp-mo-br100,fffinn,15 reviews,3 years ago,Nothing compared to surrounding shops in terms of selection
https://lh3.googleusercontent.com/a-/ALV-UjXYJm-ybN-2cTDRKVsIEzmGEud5knGaWyjAM_IVUGEluw=w72-h72-p-rp-mo-ba2-br100,Patrick Walter,Local Guide · 16 reviews,4 years ago,Hardly any clothes/shoes in the store! Very strange
https://lh3.googleusercontent.com/a-/ALV-UjXIFo9aREwnPclEQZCQ_36VBneG1oXr4ZWXS715YzEENPM=w72-h72-p-rp-mo-ba3-br100,Nika Nitro,Local Guide · 33 reviews · 11 photos,4 years ago,Totally flexible service and friendly staff
https://lh3.googleusercontent.com/a/ACg8ocLcu8RIu95Nz1vV691_KPwEIkRR3WGvIvvmaxaAQQ30=w72-h72-p-rp-mo-br100,Blanco C,130 reviews,10 months ago,Friendly and helpful staff
https://lh3.googleusercontent.com/a/ACg8ocIWPknWLuLDDSUxBoENfv8bxMy1Sk5f71OZMLDEnSyj=w72-h72-p-rp-mo-ba3-br100,Britta Weber,Local Guide · 44 reviews,5 years ago,"Large selection, friendly staff"
https://lh3.googleusercontent.com/a-/ALV-UjUQxNjFm4ZNDoNbolHCtrj2yTpmXHJd75e7YSuh4PtSAi8=w72-h72-p-rp-mo-ba4-br100,Der Rosso,Local Guide · 72 reviews · 7 photos,2 years ago,Ser nice friendly and helpful
https://lh3.googleusercontent.com/a-/ALV-UjXSCItucMUQH4yMb0Dwv9MxyC5JQlpNuEPESNN6voXLFw=w72-h72-p-rp-mo-ba6-br100,Peter P.,Local Guide · 959 reviews · 5 photos,4 years ago,"Lots of choice, pleasant, professional staff"
https://lh3.googleusercontent.com/a/ACg8ocLT06P3ZMOcFk05oAvldJV8K5mL33SoB4P3DiDaKQ9D=w72-h72-p-rp-mo-br100,Tanja Godjek,2 reviews,5 years ago,"Best shop, nice staff"
https://lh3.googleusercontent.com/a/ACg8ocIP2Zber9ZY-ta22_RBsS_Ff2vXc1x-SwUcv45C_c_L=w72-h72-p-rp-mo-br100,gert pfeifer,156 reviews,3 years ago,The selection could be a little better
https://lh3.googleusercontent.com/a/ACg8ocJEJnoVsUSZ4MYwiF7DhpIA7tGh2Iy_eP79Zhx6mqWV=w72-h72-p-rp-mo-ba3-br100,Виктория Марценюк,Local Guide · 37 reviews · 38 photos,5 years ago,Brand store. But what I liked most was the shoes.
https://lh3.googleusercontent.com/a-/ALV-UjXeMeU1A5xiN2EcBVNNDjv9lR1DdA8bWlNlGO9AE-MoBQ=w72-h72-p-rp-mo-ba5-br100,OLHI,Local Guide · 209 reviews · 49 photos,5 years ago,"Lots of choice, nice service"
https://lh3.googleusercontent.com/a-/ALV-UjUjmJq0IBUa7pospDI72ghJHhESaOyP8eVVkW7xi-9vL5I=w72-h72-p-rp-mo-ba3-br100,ahmad kargar,Local Guide · 14 reviews · 79 photos,5 years ago,It has good quality products.
https://lh3.googleusercontent.com/a/ACg8ocKB0Z9wY7AwJzdgBRhYtuHxwrGUAkonFi8pZIJJ7fX78Q=w72-h72-p-rp-mo-ba4-br100,pattzi tiaret,Local Guide · 69 reviews · 11 photos,a year ago,Too expensive
https://lh3.googleusercontent.com/a-/ALV-UjWcpNbDhcR7k1-7SvWoXUxOnpnF6rPg78s9sKtKqnes1teA=w72-h72-p-rp-mo-ba5-br100,Martin Schmidt,Local Guide · 249 reviews · 811 photos,6 years ago,A beautiful and well-equipped flagship store.
https://lh3.googleusercontent.com/a/ACg8ocLYb4SWlBa_Y2P1hHguzE0FOxZF8c8G_nV4XoDY7M1g=w72-h72-p-rp-mo-ba3-br100,Elias Gimbel,Local Guide · 32 reviews,5 years ago,Very good selection
https://lh3.googleusercontent.com/a/ACg8ocIXqS97IFp2aYsRWWwSJTrjYAAFjjytE7ps-if_lqZG=w72-h72-p-rp-mo-br100,J C,54 reviews · 30 photos,a year ago,Unfortunately little choice.
https://lh3.googleusercontent.com/a-/ALV-UjVzpaLXx8j7-Rx4Nz3K5Cl_tfUWFnXVOrZTQZnIRLV8scs=w72-h72-p-rp-mo-ba6-br100,Iliyana Paunova,"Local Guide · 402 reviews · 2,479 photos",6 years ago,The menicher on ADIDAS is friendly and scary man 🚮 …
https://lh3.googleusercontent.com/a/ACg8ocIjFH0HLgNm83b-i4svy5AgyuklbLnVkuhWtfZJifih=w72-h72-p-rp-mo-br100,KBZ 333,3 reviews,5 years ago,"Very small, little choice"
https://lh3.googleusercontent.com/a/ACg8ocKu1P4oCCJH2ebkBpOiCeVqEz9XI-qnM6ZUgVK5uBbO=w72-h72-p-rp-mo-ba4-br100,Jan Solzer,Local Guide · 130 reviews · 39 photos,4 years ago,Very good quality
https://lh3.googleusercontent.com/a/ACg8ocJ6QQnWBkkPWUcxBiUWtb1mq5SIMxXkG0CrWvxr1cfi=w72-h72-p-rp-mo-ba2-br100,Äh Äh,Local Guide · 16 reviews,5 years ago,Very large selection
https://lh3.googleusercontent.com/a-/ALV-UjXv-T43y0_PuCJWt8jcwN9JoAsjzqHsGCidDvc_RwxCflQz=w72-h72-p-rp-mo-ba5-br100,Hedi Belk (Medhedio),Local Guide · 108 reviews · 596 photos,11 months ago,
https://lh3.googleusercontent.com/a-/ALV-UjW6FJR0112hP7_wGWG3T80Ql0_0Za6UiDmvMyXcvvu1pXd4=w72-h72-p-rp-mo-br100,Frau Janke,43 reviews · 10 photos,3 years ago,Calling the department a children's department is a bit ridiculous
https://lh3.googleusercontent.com/a-/ALV-UjWxh8BtXQfMcWgnonzSMjJd0-niuro9MgLz7m4A-TtOK_8=w72-h72-p-rp-mo-ba6-br100,Andreas Kunitz,"Local Guide · 185 reviews · 1,829 photos",4 years ago,Very great product
https://lh3.googleusercontent.com/a-/ALV-UjXIFUgL6fhXG7nmZSVD3YrX0tH5rfn2LSp7s-8UyMJhnO8=w72-h72-p-rp-mo-ba6-br100,vito,"Local Guide · 240 reviews · 4,063 photos",5 years ago,Great adidas store and very organised.
https://lh3.googleusercontent.com/a-/ALV-UjUzmrB9s0v6FACvfa3fJdpS7JmwyVKBWQApAaE3U-IK_faT=w72-h72-p-rp-mo-ba5-br100,Daniel David Gimenez Nicolas,Local Guide · 230 reviews · 775 photos,4 years ago,Always the latest and greatest stuff
https://lh3.googleusercontent.com/a-/ALV-UjWoXHDgHs_RRnxCYGqEBQrbXkPYnhmMmbs43hmzUUL44G6j=w72-h72-p-rp-mo-ba8-br100,Noli lou,"Local Guide · 905 reviews · 14,281 photos",8 years ago,Quite passable | Relatively small assortment
https://lh3.googleusercontent.com/a/ACg8ocKsA-FcZUsUFkR-Ovxw3JllXlofrwDibMkBMZVsZmvZ=w72-h72-p-rp-mo-br100,Cenkay 596,1 review,6 years ago,"It's the only Adidas store in Frankfurt and despite that, there's little selection"
https://lh3.googleusercontent.com/a-/ALV-UjUTkV9dn7Y9u6_5PXifnqNLvDaIFJbqSKrJh8w1zg_bjwQ=w72-h72-p-rp-mo-br100,diego mosquera,13 reviews · 2 photos,4 years ago,Excellent atention.
https://lh3.googleusercontent.com/a-/ALV-UjXmp3fzxf-cs1hjT18u4w0QBdFLc-jhuDa26ATp_RHuuGU=w72-h72-p-rp-mo-ba3-br100,Dare,Local Guide · 47 reviews · 36 photos,5 years ago,Not exactly like Nike
https://lh3.googleusercontent.com/a/ACg8ocLHJwaESLcccHHM7v_Tx2nGzR3Q4rmkFUMNzBZlgTH3=w72-h72-p-rp-mo-br100,Nikola Smiljanic,66 reviews · 9 photos,5 years ago,"GREAT GOODS, EVEN BETTER PRICES"
https://lh3.googleusercontent.com/a-/ALV-UjUEroy0n9WNyLfY3orAE7e5B24GjskvrkKo2afPdSp-fFg=w72-h72-p-rp-mo-br100,Thomas H,232 reviews · 409 photos,4 years ago,I always find something there. 😉 …
https://lh3.googleusercontent.com/a-/ALV-UjVk6nDPL7OMVjPGukTLHzApu29cxDqPFMLtyk9LtR9qR2l8=w72-h72-p-rp-mo-ba5-br100,abdenour merghem,Local Guide · 450 reviews · 198 photos,5 years ago,A must-have for Eintracht fans
https://lh3.googleusercontent.com/a/ACg8ocKS2Z9W0_8-F30C-6GdpwCoCoXWfGTcacftvXSyhG5E=w72-h72-p-rp-mo-ba5-br100,Stefan Klaus,Local Guide · 198 reviews · 42 photos,2 years ago,Once again got a bargain!
https://lh3.googleusercontent.com/a-/ALV-UjUOLAdkSgZ8sWV9RuirobRZmEqusT-HogF4w-iUwdCVYHP_=w72-h72-p-rp-mo-ba6-br100,Bruno,"Local Guide · 345 reviews · 4,437 photos",7 years ago,Small official Adidas store top 🔝 …
https://lh3.googleusercontent.com/a-/ALV-UjX9SHPbe1cFWHisSZWhndb2SIXifyCAq5EAqk5KftFpsZBO=w72-h72-p-rp-mo-br100,Raul Mora,20 reviews · 32 photos,a year ago,Good place
https://lh3.googleusercontent.com/a/ACg8ocJVGiME7IxIU0WHxo5RXdCkO0RjEzMXMkjf347c75M2Pw=w72-h72-p-rp-mo-ba5-br100,HEINZ ROHRBACHER,Local Guide · 255 reviews · 98 photos,5 years ago,Adidas price. 😁 Quality material. …
https://lh3.googleusercontent.com/a-/ALV-UjU7Gsvsqzja-jDaEMYVqnyBJ2Y-SFijxClRbflTozoIIE_2=w72-h72-p-rp-mo-ba6-br100,Michael Hofmann,"Local Guide · 548 reviews · 1,866 photos",4 years ago,5 stars for the service
https://lh3.googleusercontent.com/a-/ALV-UjW-Ti_aJdNzut-u_fDI3uTYoLFJKKtoel9pK3GXuLnurlA=w72-h72-p-rp-mo-ba5-br100,Sebastijan Ilesic,Local Guide · 181 reviews · 892 photos,5 years ago,👍👌👏🔝🔝🔝 …
https://lh3.googleusercontent.com/a-/ALV-UjXe8OmXe9uR9S00hykjsdSaIscV9O55ti6Xk81vR6OWrg=w72-h72-p-rp-mo-br100,Penelope Duran,11 reviews · 6 photos,3 years ago,Very friendly staff
https://lh3.googleusercontent.com/a-/ALV-UjXVsVRNIS6LWfRdI7YtiCweuHNMm0jN-blDQTyOYiVBSX4=w72-h72-p-rp-mo-ba3-br100,Aliyeh Naderi,Local Guide · 19 reviews · 76 photos,3 years ago,There isn't much variety
https://lh3.googleusercontent.com/a-/ALV-UjVPEEq7Zd6WvgEMv_7JWE4lSVeCUkJTMj77VgEzyGl7f7s=w72-h72-p-rp-mo-ba3-br100,Natali Koroleva,Local Guide · 29 reviews · 33 photos,3 months ago,🔥🔥🔥🔥 …
https://lh3.googleusercontent.com/a-/ALV-UjWRSHeLRq4wjg_UgrtcmRgiFkjuAaCxiPVfEe9-bsevau8f=w72-h72-p-rp-mo-ba3-br100,Victoria Kitscha,Local Guide · 8 reviews · 7 photos,4 years ago,Very nice employees
https://lh3.googleusercontent.com/a-/ALV-UjU9xvLk6atp5t83ePV7WEZDjiMdJ_ke_veP1DF0-FlhPTs=w72-h72-p-rp-mo-ba3-br100,Britt Albert,Local Guide · 32 reviews · 16 photos,3 years ago,Very friendly staff
https://lh3.googleusercontent.com/a/ACg8ocLIYGgrqRMoeQNtReUiZ5HJufAdI-Huz1zH7AR7ZAQ=w72-h72-p-rp-mo-ba4-br100,Caro,Local Guide · 81 reviews,4 years ago,Frankfurt pedestrian zone = very expensive
https://lh3.googleusercontent.com/a/ACg8ocLHU619zFCFhYmovm0Q98M46MJgYpPI9SmAOTADoZUS=w72-h72-p-rp-mo-ba5-br100,Tobias Schulz,Local Guide · 280 reviews · 379 photos,6 years ago,Quite a small offer.
https://lh3.googleusercontent.com/a/ACg8ocIdKgaW1cWtbbJBq3yTnKzJG5UzxKXcFb-gc4II8ooJ7g=w72-h72-p-rp-mo-ba2-br100,Momo Momo,Local Guide · 16 reviews · 1 photo,5 years ago,Treats very well
https://lh3.googleusercontent.com/a-/ALV-UjW8xa_X_lk6njiHLP67zRCOn52XoC5LG7ayF1C4c7h2uyA=w72-h72-p-rp-mo-ba4-br100,Sergio Scaccio,Local Guide · 101 reviews · 7 photos,4 years ago,Good assortment
https://lh3.googleusercontent.com/a-/ALV-UjUd3OZoxwol04nwmRXbz-CLej_YDlRJfm7ElAJAdj63Hu8=w72-h72-p-rp-mo-ba4-br100,Söhnke Bari,Local Guide · 125 reviews · 29 photos,3 years ago,Protective measures are important here
https://lh3.googleusercontent.com/a/ACg8ocIbd3dCXki-lwkjJZoRkSi0q6Jj8ntgmcy9VWhBGI78=w72-h72-p-rp-mo-ba2-br100,Yrjö Matikainen,Local Guide · 1 review,6 years ago,Good store shoes.
https://lh3.googleusercontent.com/a-/ALV-UjXxUclryhauApd5l78neEWwcUoE31o1-z_ypdrD4rVOZEQ=w72-h72-p-rp-mo-br100,Mai Nguyễn,12 reviews · 3 photos,5 years ago,Very good!
https://lh3.googleusercontent.com/a/ACg8ocJn3lJPBido060nePPLpYsqlAjjbaa7MQWz046byeL4=w72-h72-p-rp-mo-ba3-br100,Bernardo Birchal,Local Guide · 66 reviews · 1 photo,5 years ago,Great store
https://lh3.googleusercontent.com/a-/ALV-UjWilz0_sEIrrm8szoGZQBJ5ZrH864llrY92vgpfWBdZR6c=w72-h72-p-rp-mo-ba3-br100,Gabriel Müller,Local Guide · 49 reviews · 71 photos,4 years ago,Kopetent
https://lh3.googleusercontent.com/a-/ALV-UjXvBRPMW9r-hDvrtjYimuvC2NCz1LvGPQw5t_qwVD-vHFc=w72-h72-p-rp-mo-br100,Olga Kadamova,63 reviews · 210 photos,a year ago,Super 👍 …
https://lh3.googleusercontent.com/a-/ALV-UjXzODNjAKGmS8sJF2OdyWkna6WMmqKaEreThrERczSezWY=w72-h72-p-rp-mo-ba3-br100,محمد ابو عمر,Local Guide · 32 reviews · 1 photo,a year ago,amazing
https://lh3.googleusercontent.com/a-/ALV-UjUa1wnEdtMi_ZDAAdCoFjWSQlqZQkqgfOX20-Ck81i8GZNk=w72-h72-p-rp-mo-ba5-br100,Niels H.,Local Guide · 140 reviews · 192 photos,5 years ago,Very expensive...
https://lh3.googleusercontent.com/a-/ALV-UjX5JAzKJfuPCwRvqbw6nQQkTE-NHt_wR9ab_qzKUHTewEw=w72-h72-p-rp-mo-ba4-br100,Stefan Kolodzeiski,Local Guide · 166 reviews · 156 photos,4 years ago,Shoes made for me!!!
https://lh3.googleusercontent.com/a/ACg8ocLtQNaBcbBxjuvvQTZpD2wxg0R5UiYnDXh228O7boK4=w72-h72-p-rp-mo-br100,Leitz Gaune,2 reviews,5 years ago,Little choice
https://lh3.googleusercontent.com/a-/ALV-UjWeFOGAzd3S9ZDKyVcqL3e-kzPUH2ev5HkD7-xlo32DAVY=w72-h72-p-rp-mo-ba5-br100,Martin “Therto”,Local Guide · 308 reviews · 183 photos,2 years ago,"Small, expensive..."
https://lh3.googleusercontent.com/a/ACg8ocKQ-nkNKhqSR3B54acnQJHJgKfex8uWFClwh2t8nyWy=w72-h72-p-rp-mo-ba3-br100,H J,Local Guide · 35 reviews · 55 photos,6 years ago,Smaller than expected
https://lh3.googleusercontent.com/a/ACg8ocIiih6BrOENk9May947qdXp-nDFawyoCeoQXtsmktt8=w72-h72-p-rp-mo-ba5-br100,Emad Almejadi,Local Guide · 257 reviews · 66 photos,4 years ago,New and special merchandise
https://lh3.googleusercontent.com/a/ACg8ocJEg2YgkGCu44x3ZPkg_WdngfjgUQ7qHt-bhb1EjqSL=w72-h72-p-rp-mo-br100,Krzysztof Uliś,10 reviews,4 years ago,It sucks
https://lh3.googleusercontent.com/a-/ALV-UjWFZujfkygmpQPOuRaKfCgyehTWgncVysFuTyHC0TGYRyU=w72-h72-p-rp-mo-ba5-br100,Jakob Broitman,Local Guide · 291 reviews · 146 photos,3 years ago,Very good sportswear
